{
  "$schema": "http://json-schema.org/draft-07/schema#",
  "$id": "https://niovlabs.com/foundation/dandelion-governance-review/governance-review.schema.json",
  "title": "NIOV Foundation Dandelion Stage D Governance Review Substrate Schema",
  "description": "Validation schema for D4 Dandelion Governance Review Substrate at docs/dandelion-governance-review/. Each file is a wrapper containing kind + catalog_version + envelope_defaults + items[]. Each item is a MapGovernanceReview that consumes the matching D3 MapRecommendation and surfaces it for admin review with explicit approval_chain + dual_control + escalation_path. STATIC GOVERNANCE REVIEW SUBSTRATE ONLY — every review_state is PROPOSED_NOT_REVIEWED. Per ADR-0082 + Amendment 1: Dandelion maps the territory; admins approve the map; Foundation governs what can happen inside the map.",
  "type": "object",
  "required": ["kind", "catalog_version", "envelope_defaults", "items"],
  "additionalProperties": false,
  "properties": {
    "$schema": { "type": "string" },
    "envelope_defaults": { "$ref": "#/definitions/EnvelopeDefaults" },
    "kind": { "type": "string", "enum": ["MapGovernanceReview"] },
    "catalog_version": { "type": "string", "pattern": "^[0-9]+\\.[0-9]+\\.[0-9]+$" },
    "items": { "type": "array", "minItems": 1, "items": { "$ref": "#/definitions/GovernanceReviewItem" } }
  },
  "definitions": {
    "GovernanceReviewItem": {
      "type": "object",
      "required": [
        "id",
        "version",
        "status",
        "object_type",
        "map_type",
        "name",
        "description",
        "human_readable_summary",
        "model_usage_notes",
        "source_adr_refs",
        "consumes_recommendation_id",
        "region_reviews",
        "approval_chain",
        "dual_control_required",
        "escalation_path",
        "DMW_scope_implications",
        "governance_review_points",
        "safe_defaults",
        "forbidden_defaults",
        "allowed_consumers",
        "forbidden_consumers",
        "audit_expectations",
        "review_state"
      ],
      "properties": {
        "id": { "type": "string", "pattern": "^[a-z][a-zA-Z0-9_-]*(\\.[a-zA-Z0-9][a-zA-Z0-9_-]*)+\\.v[0-9]+$" },
        "version": { "type": "string", "pattern": "^[0-9]+$" },
        "status": { "type": "string", "enum": ["ACCEPTED", "PROPOSED", "DEPRECATED"] },
        "object_type": { "type": "string", "const": "MapGovernanceReview" },
        "map_type": {
          "type": "string",
          "enum": ["CompanyMap", "OrgRelationshipMap", "RoleMap", "ToolMap", "WorkflowMap", "AuthorityMap", "MemoryDmwMap", "RiskMap", "AhaMomentMap"]
        },
        "name": { "type": "string", "minLength": 1 },
        "description": { "type": "string", "minLength": 1 },
        "human_readable_summary": { "type": "string", "minLength": 1 },
        "model_usage_notes": { "type": "string", "minLength": 1 },
        "source_adr_refs": {
          "type": "array",
          "minItems": 1,
          "items": { "type": "string", "pattern": "^(ADR-[0-9]{4}|RULE [0-9]+|US [0-9,]+)$" }
        },
        "consumes_recommendation_id": { "type": "string", "pattern": "^recommendation\\.[a-z][a-zA-Z0-9_-]*(\\.[a-zA-Z0-9][a-zA-Z0-9_-]*)*\\.v[0-9]+$" },
        "region_reviews": {
          "type": "array",
          "minItems": 1,
          "items": {
            "type": "object",
            "required": [
              "region_id",
              "admin_approval_required",
              "dual_control_required",
              "approval_chain_role",
              "review_outcome_options"
            ],
            "properties": {
              "region_id": { "type": "string", "minLength": 1 },
              "admin_approval_required": { "type": "boolean" },
              "dual_control_required": { "type": "boolean" },
              "approval_chain_role": { "type": "string", "minLength": 1 },
              "review_outcome_options": {
                "type": "array",
                "minItems": 1,
                "items": {
                  "type": "string",
                  "enum": ["APPROVE", "APPROVE_WITH_CONDITIONS", "DEFER_FOR_MORE_INFO", "REJECT", "ESCALATE_TO_FOUNDER"]
                }
              }
            },
            "additionalProperties": true
          }
        },
        "approval_chain": {
          "type": "array",
          "items": { "type": "string" },
          "minItems": 1
        },
        "dual_control_required": { "type": "boolean" },
        "escalation_path": {
          "type": "array",
          "items": { "type": "string" },
          "minItems": 1
        },
        "DMW_scope_implications": { "type": "array", "items": { "type": "string" }, "minItems": 1 },
        "governance_review_points": { "type": "array", "items": { "type": "string" }, "minItems": 1 },
        "safe_defaults": { "type": "array", "items": { "type": "string" } },
        "forbidden_defaults": { "type": "array", "items": { "type": "string" } },
        "allowed_consumers": { "type": "array", "items": { "type": "string" } },
        "forbidden_consumers": { "type": "array", "items": { "type": "string" } },
        "audit_expectations": { "type": "array", "items": { "type": "string" }, "minItems": 1 },
        "review_state": { "type": "string", "const": "PROPOSED_NOT_REVIEWED" }
      },
      "additionalProperties": true
    },
    "EnvelopeDefaults": {
      "type": "object",
      "required": ["object_type", "human_readable_summary", "model_usage_notes", "scope_defaults", "permission_defaults", "provenance", "audit_expectations", "policy_purpose", "allowed_consumers", "forbidden_consumers", "sensitivity_level"],
      "additionalProperties": true,
      "properties": {
        "object_type": { "type": "string" },
        "human_readable_summary": { "type": "string" },
        "model_usage_notes": { "type": "string" },
        "scope_defaults": { "type": "array", "items": { "type": "string" } },
        "permission_defaults": { "type": "array", "items": { "type": "string" } },
        "provenance": {
          "type": "object",
          "required": ["authored_by", "source", "version_tag", "captured_at", "authority"]
        },
        "audit_expectations": { "type": "array", "items": { "type": "string" } },
        "policy_purpose": { "type": "string" },
        "allowed_consumers": { "type": "array", "items": { "type": "string" } },
        "forbidden_consumers": { "type": "array", "items": { "type": "string" } },
        "sensitivity_level": { "type": "string", "enum": ["LOW", "MEDIUM", "HIGH", "CRITICAL"] }
      }
    }
  }
}
