{
  "$schema": "./governance-review.schema.json",
  "kind": "MapGovernanceReview",
  "catalog_version": "1.0.0",
  "envelope_defaults": {
    "object_type": "MapGovernanceReview",
    "human_readable_summary": "Dandelion maps the territory. Admins approve the map. Foundation governs what can happen inside the map. DMWs scope what can be remembered. Digital Twins operate within the approved terrain.",
    "model_usage_notes": "Reviews are PROPOSED_NOT_REVIEWED. User must confirm own role; admin approves Twin capability activation. No workforce-scoring inferences during review.",
    "scope_defaults": ["TENANT_SCOPED", "GOVERNANCE_REVIEW_SCOPED", "ROLE_SCOPED"],
    "permission_defaults": ["READ_FIRST", "USER_CONFIRMATION_REQUIRED", "ADMIN_REVIEW_REQUIRED"],
    "provenance": {
      "authored_by": "NIOV Labs / niov-foundation",
      "source": "docs/dandelion-governance-review/role-map-governance-review.json",
      "version_tag": "d4-v1.0.0",
      "captured_at": "2026-06-01",
      "authority": "[FOUNDATION-D4-DANDELION-GOVERNANCE-REVIEW]"
    },
    "audit_expectations": ["ADMIN_ACTION:MAP_GOVERNANCE_REVIEW_REFERENCED when consumed"],
    "policy_purpose": "GOVERNANCE_REVIEW_REFERENCE_ONLY",
    "allowed_consumers": ["DANDELION_GOVERNANCE_REVIEW_ENGINE", "ADMIN_TWIN_SCOPED_TO_ORG", "AGENT_TWIN_SCOPED_TO_USER", "CONTROL_TOWER_ADMIN_REVIEW", "FOUNDATION_GOVERNANCE_TIER"],
    "forbidden_consumers": ["AGENT_TWIN_CROSS_TENANT", "AGENT_TWIN_AUTONOMOUS_ACTIVATION", "MANAGER_SURVEILLANCE_TOOL", "EMPLOYEE_SCORING_TOOL", "EXTERNAL_THIRD_PARTY_UNAUTHORIZED"],
    "sensitivity_level": "HIGH"
  },
  "items": [
    {
      "id": "review.role-map.v1",
      "version": "1",
      "status": "ACCEPTED",
      "object_type": "MapGovernanceReview",
      "map_type": "RoleMap",
      "name": "Role Map Governance Review",
      "description": "Surfaces D3 Role Map recommendation regions for user confirmation + admin governance review. Twin day-one capabilities require admin policy approval. Sensitive-scope exclusions remain absolute.",
      "human_readable_summary": "User confirms own role match; admin approves Twin capability activation. Sensitive scopes excluded at intake stay excluded.",
      "model_usage_notes": "Role-template match requires user confirmation before admin can approve capabilities. Wave 2.1 DEEP roles (6 of 21) get straightforward APPROVE paths; out-of-catalog roles get DEFER_FOR_MORE_INFO until role-depth substrate covers them.",
      "source_adr_refs": ["ADR-0082", "ADR-0080", "ADR-0027", "RULE 0"],
      "consumes_recommendation_id": "recommendation.role-map.v1",
      "region_reviews": [
        { "region_id": "role.template-match", "admin_approval_required": false, "dual_control_required": false, "approval_chain_role": "User Self-Confirmation", "review_outcome_options": ["APPROVE", "DEFER_FOR_MORE_INFO", "REJECT"] },
        { "region_id": "role.day-one-capabilities", "admin_approval_required": true, "dual_control_required": false, "approval_chain_role": "Otzar Administrator", "review_outcome_options": ["APPROVE", "APPROVE_WITH_CONDITIONS", "DEFER_FOR_MORE_INFO", "REJECT"] },
        { "region_id": "role.first-week-aha", "admin_approval_required": true, "dual_control_required": false, "approval_chain_role": "Otzar Administrator + User Confirmation", "review_outcome_options": ["APPROVE", "APPROVE_WITH_CONDITIONS", "DEFER_FOR_MORE_INFO"] },
        { "region_id": "role.sensitive-scope-exclusion", "admin_approval_required": true, "dual_control_required": false, "approval_chain_role": "Otzar Administrator", "review_outcome_options": ["APPROVE", "APPROVE_WITH_CONDITIONS", "ESCALATE_TO_FOUNDER"] }
      ],
      "approval_chain": ["User Self-Confirmation", "Otzar Administrator"],
      "dual_control_required": false,
      "escalation_path": ["User → Otzar Administrator", "Otzar Administrator → Founder (for sensitive-scope expansions only)"],
      "DMW_scope_implications": [
        "Approved Role Map bounds Role-scoped DMW memory per Wave 2.1 §25",
        "Sensitive scopes excluded at intake remain excluded at DMW activation",
        "Twin day-one capabilities map to allowed DMW categories per OOTB role-depth"
      ],
      "governance_review_points": [
        "User confirms role before Twin activation",
        "Admin approves every Role Map region before capability lights up",
        "No workforce-scoring inferences from role + responsibility data during review"
      ],
      "safe_defaults": ["User-confirmed role match", "Admin-approved Map region", "OOTB role-depth defaults as starter priors"],
      "forbidden_defaults": ["Autonomous Twin capability activation", "Workforce-scoring inferences during review", "Managerial-oversight monitoring", "Cross-tenant role fusion"],
      "allowed_consumers": ["DANDELION_GOVERNANCE_REVIEW_ENGINE", "ADMIN_TWIN_SCOPED_TO_ORG", "AGENT_TWIN_SCOPED_TO_USER", "CONTROL_TOWER_ADMIN_REVIEW", "FOUNDATION_GOVERNANCE_TIER"],
      "forbidden_consumers": ["AGENT_TWIN_CROSS_TENANT", "AGENT_TWIN_AUTONOMOUS_ACTIVATION", "MANAGER_SURVEILLANCE_TOOL", "EMPLOYEE_SCORING_TOOL", "EXTERNAL_THIRD_PARTY_UNAUTHORIZED"],
      "audit_expectations": ["ADMIN_ACTION:MAP_GOVERNANCE_REVIEW_REFERENCED when consumed"],
      "review_state": "PROPOSED_NOT_REVIEWED"
    }
  ]
}
