{
  "$schema": "./governance-review.schema.json",
  "kind": "MapGovernanceReview",
  "catalog_version": "1.0.0",
  "envelope_defaults": {
    "object_type": "MapGovernanceReview",
    "human_readable_summary": "Dandelion maps the territory. Admins approve the map. Foundation governs what can happen inside the map. DMWs scope what can be remembered. Digital Twins operate within the approved terrain.",
    "model_usage_notes": "Reviews are PROPOSED_NOT_REVIEWED. ADR-0081 5-stage maturity governs workflow review depth. Stage 3+ workflows require explicit policy approval + per-call governance.",
    "scope_defaults": ["TENANT_SCOPED", "GOVERNANCE_REVIEW_SCOPED"],
    "permission_defaults": ["READ_FIRST", "ADMIN_REVIEW_REQUIRED", "NO_EXECUTION_FROM_REVIEW"],
    "provenance": {
      "authored_by": "NIOV Labs / niov-foundation",
      "source": "docs/dandelion-governance-review/workflow-map-governance-review.json",
      "version_tag": "d4-v1.0.0",
      "captured_at": "2026-06-01",
      "authority": "[FOUNDATION-D4-DANDELION-GOVERNANCE-REVIEW]"
    },
    "audit_expectations": ["ADMIN_ACTION:MAP_GOVERNANCE_REVIEW_REFERENCED when consumed"],
    "policy_purpose": "GOVERNANCE_REVIEW_REFERENCE_ONLY",
    "allowed_consumers": ["DANDELION_GOVERNANCE_REVIEW_ENGINE", "ADMIN_TWIN_SCOPED_TO_ORG", "AGENT_TWIN_SCOPED_TO_USER", "CONTROL_TOWER_ADMIN_REVIEW", "FOUNDATION_GOVERNANCE_TIER"],
    "forbidden_consumers": ["AGENT_TWIN_CROSS_TENANT", "AGENT_TWIN_AUTONOMOUS_EXECUTION", "MANAGER_SURVEILLANCE_TOOL", "EMPLOYEE_SCORING_TOOL", "EXTERNAL_THIRD_PARTY_UNAUTHORIZED"],
    "sensitivity_level": "HIGH"
  },
  "items": [
    {
      "id": "review.workflow-map.v1",
      "version": "1",
      "status": "ACCEPTED",
      "object_type": "MapGovernanceReview",
      "map_type": "WorkflowMap",
      "name": "Workflow Map Governance Review",
      "description": "Surfaces D3 Workflow Map recommendation regions for admin governance review. Stage 1 (templates) + Stage 2 (recommendations) require admin review; Stages 3-5 (proposed-action / governed execution / continuous optimization) require explicit policy approval + per-call governance.",
      "human_readable_summary": "Admin reviews workflow stage progression. Stages 1-2 baseline; Stages 3-5 require explicit policy approval + dual-control for risky writes.",
      "model_usage_notes": "Stage 1-2 workflows can land with standard admin approval. Stages 3-5 require named policy approver per ADR-0081 + dual-control per ADR-0026 for risky writes.",
      "source_adr_refs": ["ADR-0082", "ADR-0081", "ADR-0080", "ADR-0026", "RULE 0"],
      "consumes_recommendation_id": "recommendation.workflow-map.v1",
      "region_reviews": [
        { "region_id": "workflow.stage-1-templates", "admin_approval_required": true, "dual_control_required": false, "approval_chain_role": "Otzar Administrator", "review_outcome_options": ["APPROVE", "APPROVE_WITH_CONDITIONS", "DEFER_FOR_MORE_INFO"] },
        { "region_id": "workflow.stage-2-recommendations", "admin_approval_required": true, "dual_control_required": false, "approval_chain_role": "Otzar Administrator + Workflow Owner", "review_outcome_options": ["APPROVE", "APPROVE_WITH_CONDITIONS", "DEFER_FOR_MORE_INFO", "REJECT"] },
        { "region_id": "workflow.stage-3-proposed-action", "admin_approval_required": true, "dual_control_required": true, "approval_chain_role": "Otzar Administrator + Workflow Owner + Policy Approver", "review_outcome_options": ["APPROVE", "APPROVE_WITH_CONDITIONS", "DEFER_FOR_MORE_INFO", "REJECT", "ESCALATE_TO_FOUNDER"] },
        { "region_id": "workflow.safe-fallback", "admin_approval_required": true, "dual_control_required": false, "approval_chain_role": "Otzar Administrator", "review_outcome_options": ["APPROVE", "DEFER_FOR_MORE_INFO"] },
        { "region_id": "workflow.dual-control-required", "admin_approval_required": true, "dual_control_required": true, "approval_chain_role": "Otzar Administrator + Security Lead", "review_outcome_options": ["APPROVE", "APPROVE_WITH_CONDITIONS", "REJECT"] }
      ],
      "approval_chain": ["Otzar Administrator", "Workflow Owner", "Policy Approver (Stage 3+)", "Security Lead (dual-control workflows)"],
      "dual_control_required": true,
      "escalation_path": ["Otzar Administrator → Workflow Owner", "Workflow Owner → Policy Approver", "Policy Approver → Founder (ESCALATE_TO_FOUNDER for Stage 4-5 review)"],
      "DMW_scope_implications": [
        "Approved workflows bound workflow-scoped DMW provenance per ADR-0081",
        "Stage 3+ workflows constrain Authority Map DMW scope downstream",
        "Safe-fallback workflows operate inside baseline DMW scope only"
      ],
      "governance_review_points": [
        "Admin must approve every workflow stage progression",
        "Stages 3-5 require Policy Approver + per-call governance",
        "Dual-control mandatory for risky writes regardless of stage",
        "Workflow purpose binding required at activation per ADR-0081"
      ],
      "safe_defaults": ["Stage 1-2 baseline", "Admin + Workflow Owner approval", "Per-call governance for Stage 3+", "Dual-control for risky writes", "Safe-fallback documented per workflow"],
      "forbidden_defaults": ["Autonomous execution from review", "Stage 3+ approval without explicit Policy Approver sign-off", "Cross-tenant workflow fusion", "Workforce-scoring inferences from workflow throughput"],
      "allowed_consumers": ["DANDELION_GOVERNANCE_REVIEW_ENGINE", "ADMIN_TWIN_SCOPED_TO_ORG", "AGENT_TWIN_SCOPED_TO_USER", "CONTROL_TOWER_ADMIN_REVIEW", "FOUNDATION_GOVERNANCE_TIER"],
      "forbidden_consumers": ["AGENT_TWIN_CROSS_TENANT", "AGENT_TWIN_AUTONOMOUS_EXECUTION", "MANAGER_SURVEILLANCE_TOOL", "EMPLOYEE_SCORING_TOOL", "EXTERNAL_THIRD_PARTY_UNAUTHORIZED"],
      "audit_expectations": ["ADMIN_ACTION:MAP_GOVERNANCE_REVIEW_REFERENCED when consumed", "future ACTION_* at Stage 3+ runtime"],
      "review_state": "PROPOSED_NOT_REVIEWED"
    }
  ]
}
